{
  "contract_name": "branch-nav-v1",
  "schema_version": "1.0.0",
  "producer_version": "1.0.0",
  "data_as_of": "2026-07-27T06:00:00Z",
  "created_at": "2026-07-27T06:10:00Z",
  "source_hashes": [
    {
      "source": "balanced-branch-ledger",
      "sha256": "2828282828282828282828282828282828282828282828282828282828282828"
    }
  ],
  "nav_artifact_id": "branch-nav-origin-000001",
  "origin_ref": {
    "contract_name": "evaluation-origin-v1",
    "artifact_id": "evaluation-origin-000001",
    "schema_version": "1.0.0",
    "sha256": "c9cbfad5eebcd7e46716020771d9ea2715b5ab178a745378304055a6aeb0787d",
    "created_at": "2026-07-24T06:15:00Z"
  },
  "config_ref": {
    "contract_name": "evaluator-config-v1",
    "artifact_id": "evaluator-config-paper-001",
    "schema_version": "1.0.0",
    "sha256": "0c2e63a9f563bb50672f5cf97604ca1cd1b887eff72f43dea0b6116d6a9fa4b6",
    "created_at": "2026-07-24T06:10:00Z"
  },
  "ledger_ref": {
    "contract_name": "branch-ledger-v1",
    "artifact_id": "branch-ledger-origin-000001",
    "schema_version": "1.0.0",
    "sha256": "bb6ecb5d7072046ca4c839b13657f62914383c57beb065817050c2ddecf39607",
    "created_at": "2026-07-27T06:05:00Z"
  },
  "accounting_policy_ref": {
    "contract_name": "accounting-policy-v1",
    "artifact_id": "accounting-paper-asx-001",
    "schema_version": "1.0.0",
    "sha256": "591a6013ad4afe797f478138e8ed6d5940aa796563c471b1e6b1095dbc2ddd91",
    "created_at": "2026-07-24T06:06:00Z"
  },
  "benchmark_policy_ref": {
    "contract_name": "benchmark-policy-v1",
    "artifact_id": "benchmark-paper-asx-001",
    "schema_version": "1.0.0",
    "sha256": "f5f3a11118ddd52bc24d57b03979ce7960796db883bd9a17467127b4ed1afcc5",
    "created_at": "2026-07-24T06:07:00Z"
  },
  "branches": [
    {
      "branch_id": "PROPOSAL_BASE",
      "series_status": "INCOMPLETE",
      "entries": [
        {
          "session_date": "2026-07-27",
          "status": "UNAVAILABLE",
          "beginning_nav_aud": "100000.000000",
          "cash_aud": "97512.550000",
          "positions_aud": "2477.500000",
          "receivables_aud": "0.000000",
          "payables_aud": "0.000000",
          "accrued_fees_aud": "9.950000",
          "realized_tax_payable_aud": "0.000000",
          "deferred_tax_liability_aud": "0.000000",
          "ending_nav_aud": "99980.100000",
          "external_flows_aud": "0.000000",
          "weighted_external_flows_aud": "0.000000",
          "modified_dietz_return": null,
          "active_log_return_vs_hold": null,
          "active_log_return_vs_xjo_tr": null,
          "source_snapshot_sha256": "2929292929292929292929292929292929292929292929292929292929292929",
          "reason_codes": [
            "LEDGER_EVENT_CHAIN_INCOMPLETE"
          ]
        }
      ],
      "series_sha256": "3030303030303030303030303030303030303030303030303030303030303030",
      "missing_session_count": "1"
    },
    {
      "branch_id": "PROPOSAL_STRESS",
      "series_status": "INCOMPLETE",
      "entries": [
        {
          "session_date": "2026-07-27",
          "status": "UNAVAILABLE",
          "beginning_nav_aud": "100000.000000",
          "cash_aud": "97480.000000",
          "positions_aud": "2477.500000",
          "receivables_aud": "0.000000",
          "payables_aud": "0.000000",
          "accrued_fees_aud": "9.950000",
          "realized_tax_payable_aud": "0.000000",
          "deferred_tax_liability_aud": "0.000000",
          "ending_nav_aud": "99947.550000",
          "external_flows_aud": "0.000000",
          "weighted_external_flows_aud": "0.000000",
          "modified_dietz_return": null,
          "active_log_return_vs_hold": null,
          "active_log_return_vs_xjo_tr": null,
          "source_snapshot_sha256": "3131313131313131313131313131313131313131313131313131313131313131",
          "reason_codes": [
            "LEDGER_EVENT_CHAIN_INCOMPLETE"
          ]
        }
      ],
      "series_sha256": "3232323232323232323232323232323232323232323232323232323232323232",
      "missing_session_count": "1"
    },
    {
      "branch_id": "HOLD",
      "series_status": "INCOMPLETE",
      "entries": [
        {
          "session_date": "2026-07-27",
          "status": "UNAVAILABLE",
          "beginning_nav_aud": "100000.000000",
          "cash_aud": "100000.000000",
          "positions_aud": "0.000000",
          "receivables_aud": "0.000000",
          "payables_aud": "0.000000",
          "accrued_fees_aud": "0.000000",
          "realized_tax_payable_aud": "0.000000",
          "deferred_tax_liability_aud": "0.000000",
          "ending_nav_aud": "100000.000000",
          "external_flows_aud": "0.000000",
          "weighted_external_flows_aud": "0.000000",
          "modified_dietz_return": null,
          "active_log_return_vs_hold": null,
          "active_log_return_vs_xjo_tr": null,
          "source_snapshot_sha256": "3333333333333333333333333333333333333333333333333333333333333333",
          "reason_codes": [
            "LEDGER_EVENT_CHAIN_INCOMPLETE"
          ]
        }
      ],
      "series_sha256": "3434343434343434343434343434343434343434343434343434343434343434",
      "missing_session_count": "1"
    },
    {
      "branch_id": "XJO_TR",
      "series_status": "INCOMPLETE",
      "entries": [
        {
          "session_date": "2026-07-27",
          "status": "UNAVAILABLE",
          "beginning_nav_aud": "100000.000000",
          "cash_aud": "0.000000",
          "positions_aud": "100010.000000",
          "receivables_aud": "0.000000",
          "payables_aud": "0.000000",
          "accrued_fees_aud": "0.000000",
          "realized_tax_payable_aud": "0.000000",
          "deferred_tax_liability_aud": "0.000000",
          "ending_nav_aud": "100010.000000",
          "external_flows_aud": "0.000000",
          "weighted_external_flows_aud": "0.000000",
          "modified_dietz_return": null,
          "active_log_return_vs_hold": null,
          "active_log_return_vs_xjo_tr": null,
          "source_snapshot_sha256": "a850d23cf9674e23abc9e9f9b91a73d5a0088872db05e9ce1046aaac73f4eb61",
          "benchmark_snapshot_ref": {
            "contract_name": "benchmark-snapshot-v1",
            "artifact_id": "benchmark-snapshot-xjo-tr-20260727-r1",
            "schema_version": "1.0.0",
            "sha256": "a850d23cf9674e23abc9e9f9b91a73d5a0088872db05e9ce1046aaac73f4eb61",
            "created_at": "2026-07-27T06:01:00Z"
          },
          "reason_codes": [
            "LEDGER_EVENT_CHAIN_INCOMPLETE"
          ]
        }
      ],
      "series_sha256": "3636363636363636363636363636363636363636363636363636363636363636",
      "missing_session_count": "1"
    },
    {
      "branch_id": "CASH",
      "series_status": "INCOMPLETE",
      "entries": [
        {
          "session_date": "2026-07-27",
          "status": "UNAVAILABLE",
          "beginning_nav_aud": "100000.000000",
          "cash_aud": "100008.000000",
          "positions_aud": "0.000000",
          "receivables_aud": "0.000000",
          "payables_aud": "0.000000",
          "accrued_fees_aud": "0.000000",
          "realized_tax_payable_aud": "2.000000",
          "deferred_tax_liability_aud": "0.000000",
          "ending_nav_aud": "100006.000000",
          "external_flows_aud": "0.000000",
          "weighted_external_flows_aud": "0.000000",
          "modified_dietz_return": null,
          "active_log_return_vs_hold": null,
          "active_log_return_vs_xjo_tr": null,
          "source_snapshot_sha256": "3737373737373737373737373737373737373737373737373737373737373737",
          "reason_codes": [
            "LEDGER_EVENT_CHAIN_INCOMPLETE"
          ]
        }
      ],
      "series_sha256": "3838383838383838383838383838383838383838383838383838383838383838",
      "missing_session_count": "1"
    }
  ],
  "canonical_hash": {
    "canonicalization": "RFC8785",
    "hash_algorithm": "SHA-256",
    "excluded_json_pointer": "/canonical_hash/payload_sha256",
    "payload_sha256": "e728c7ac8a648e936fe453e960b0c2cf08538ebf8b0efe73db910a0a6824bdb6"
  },
  "controls": {
    "external_flows_are_not_return": true,
    "cost_and_tax_are_expenses": true,
    "imputation_permitted": false,
    "decimal_math": true
  }
}
